city_name,avg_comfort_index,recommended_activity,tourist_season_match,tourism_season,tour_recommendation,as_of_date
Новосибирск,-6.89,домашний отдых,нет,май-август,домашний отдых вне сезона,2025-10-07 14:47
Москва,-1.1,домашний отдых,нет,май-август,домашний отдых вне сезона,2025-10-07 14:47
Санкт-Петербург,7.75,домашний отдых,нет,май-август,домашний отдых вне сезона,2025-10-07 14:47
Казань,12.55,культурный туризм,нет,май-август,культурный туризм вне сезона,2025-10-07 14:47
Сочи,16.05,активный туризм,нет,май-август,активный туризм вне сезона,2025-10-07 14:47
