city_name,avg_comfort_index,recommended_activity,tourist_season_match,tourism_season,tour_recommendation,as_of_date
Новосибирск,-6.84,домашний отдых,нет,май-август,домашний отдых вне сезона,2025-10-07 14:38
Москва,-1.14,домашний отдых,нет,май-август,домашний отдых вне сезона,2025-10-07 14:38
Санкт-Петербург,7.54,домашний отдых,нет,май-август,домашний отдых вне сезона,2025-10-07 14:38
Казань,12.64,культурный туризм,нет,май-август,культурный туризм вне сезона,2025-10-07 14:38
Сочи,16.14,активный туризм,нет,май-август,активный туризм вне сезона,2025-10-07 14:38
